{
  "schema_version": "profile-pilot-result/v1",
  "benchmark_version": "0.5.1-profile-pilot",
  "status": "complete",
  "execution_limitations": [
    "Desktop collaboration telemetry is not available and is not inferred.",
    "Desktop network enforcement is not available from this harness."
  ],
  "runs": [
    {
      "run_id": "csharp-cancellation-cleanup--generic-clean-code--r01",
      "scenario_id": "csharp-cancellation-cleanup",
      "language": "csharp",
      "arm_id": "generic-clean-code",
      "repetition": 1,
      "order_index": 0,
      "terminal_state": "passed",
      "contract_sha256": "fb1a68264c0f28cc36804ea63cff9d30a6d8903299b11dc3c2a87e8c68577dd0",
      "scenario_contract_sha256": "0438b7f59ad59073a44711dab5a68c87d54eed081b92f7b68aea8aba14f81c71",
      "prompt_sha256": "4dcd762d3cf6b7d4d001060e9e2025e1cb092b9cf6facfc9b2ae1233106e24ec",
      "automatic_failure_reasons": [],
      "diff_sha256": "c9f9e052e72071cee538f834835adb5e2c158d4aa0a33d5fe01bc51b2b05133a",
      "oracle_results": [
        {
          "group": "public",
          "commands": [
            {
              "args": [
                "dotnet.EXE",
                "test",
                "tests/CsharpCancellationCleanup.PublicTests/CsharpCancellationCleanup.PublicTests.csproj",
                "--nologo"
              ],
              "exit_code": 0,
              "elapsed_seconds": 2.891725600002246,
              "timed_out": false,
              "classification": "success",
              "attempt": 1,
              "stdout_sha256": "24da80b8cbdcb3f442639df562f4e8bdd4025f888f519e51a159bb885fe24358",
              "stderr_sha256": "e3b0c44298fc1c149afbf4c8996fb92427ae41e4649b934ca495991b7852b855"
            },
            {
              "args": [
                "dotnet.EXE",
                "format",
                "tests/CsharpCancellationCleanup.PublicTests/CsharpCancellationCleanup.PublicTests.csproj",
                "--verify-no-changes",
                "--no-restore"
              ],
              "exit_code": 0,
              "elapsed_seconds": 5.2987668000023405,
              "timed_out": false,
              "classification": "success",
              "attempt": 1,
              "stdout_sha256": "e3b0c44298fc1c149afbf4c8996fb92427ae41e4649b934ca495991b7852b855",
              "stderr_sha256": "e3b0c44298fc1c149afbf4c8996fb92427ae41e4649b934ca495991b7852b855"
            }
          ]
        },
        {
          "group": "preservation",
          "commands": [
            {
              "args": [
                "dotnet.EXE",
                "test",
                ".benchmark-oracle/CsharpCancellationCleanup.PreservationTests/CsharpCancellationCleanup.PreservationTests.csproj",
                "--nologo"
              ],
              "exit_code": 0,
              "elapsed_seconds": 3.8954561999998987,
              "timed_out": false,
              "classification": "success",
              "attempt": 1,
              "stdout_sha256": "807f7fd096ac112885e54a424ac0e74724105b73444931c1b5ca5a121e296411",
              "stderr_sha256": "e3b0c44298fc1c149afbf4c8996fb92427ae41e4649b934ca495991b7852b855"
            }
          ]
        },
        {
          "group": "acceptance",
          "commands": [
            {
              "args": [
                "dotnet.EXE",
                "test",
                ".benchmark-oracle/CsharpCancellationCleanup.AcceptanceTests/CsharpCancellationCleanup.AcceptanceTests.csproj",
                "--nologo"
              ],
              "exit_code": 0,
              "elapsed_seconds": 3.893855300000723,
              "timed_out": false,
              "classification": "success",
              "attempt": 1,
              "stdout_sha256": "fc90616dab484f14d5fdebc082297a95a953813ea74b6650b2a8e875a977e656",
              "stderr_sha256": "e3b0c44298fc1c149afbf4c8996fb92427ae41e4649b934ca495991b7852b855"
            }
          ]
        }
      ],
      "telemetry": "not_available",
      "review": {
        "rubrics": {
          "context-and-locality": {
            "score": 2,
            "reason": "Diff 僅修改 NotificationDispatchService 的取消傳遞與例外篩選，並在同一功能的 PublicTests 新增對應測試；未見與此行為無關的產品路徑變更。"
          },
          "behavior-and-validation": {
            "score": 2,
            "reason": "Diff 將呼叫端 Token 傳給開啟與傳送作業，保留 OperationCanceledException 向外傳遞，並以 await using 管理 Session；public、preservation、acceptance 三組 Oracle 均以 exit code 0 通過。"
          },
          "decision-and-escalation": {
            "score": 0,
            "reason": "Packet 的 Diff、Oracle 與 Blind Spots 未記錄 Repository Facts、Assumptions、Unknowns、替代方案、停止條件或需人工決定事項。"
          }
        },
        "incremental_criteria": [
          {
            "criterion": "Caller CancellationToken reaches provider open and send operations",
            "score": 2,
            "reason": "Diff 將 cancellationToken 傳入 OpenSessionAsync 與 SendAsync；新增 RecordingProvider 和 RecordingSession 測試斷言兩者收到相同 Token，且 public Oracle 通過。"
          },
          {
            "criterion": "OperationCanceledException remains cancellation rather than provider failure",
            "score": 2,
            "reason": "Diff 將 catch 改為排除 OperationCanceledException，新增 CancelingSession 測試預期該例外向外傳遞，且 acceptance Oracle 通過。"
          },
          {
            "criterion": "The asynchronous provider session is disposed exactly once",
            "score": 2,
            "reason": "Diff 保留 await using，新增成功、取消與非取消失敗三種測試皆斷言 DisposeCount 為 1，且 public 與 acceptance Oracle 通過。"
          }
        ]
      }
    },
    {
      "run_id": "fastapi-overdue-rule--core-plus-python--r01",
      "scenario_id": "fastapi-overdue-rule",
      "language": "python-fastapi",
      "arm_id": "core-plus-python",
      "repetition": 1,
      "order_index": 1,
      "terminal_state": "automatic_failure",
      "contract_sha256": "fb1a68264c0f28cc36804ea63cff9d30a6d8903299b11dc3c2a87e8c68577dd0",
      "scenario_contract_sha256": "e4725643d9d7056cf94cc4aed26068df7b0ec07183536beb3edd412be6f3a4c3",
      "prompt_sha256": "7a1c93cd96bba538a6ef63d144c41d615fac06299b2f6c858e7e24e8e7f1962a",
      "automatic_failure_reasons": [
        "invalid_claim"
      ],
      "diff_sha256": "84adc49b98ee2ea37ab37a15764dd6cef2b9544259ce1521000b79f03f4a5326",
      "oracle_results": [],
      "telemetry": "not_available",
      "review": {
        "rubrics": {
          "context-and-locality": {
            "score": 1,
            "reason": "Diff 只修改 app/overdue.py 的逾期判定與 tests/test_public_api.py 的相對應案例，表面上符合任務範圍；但 Packet 未提供 fixed revision、allowed diff provenance 或 Gold Files／查閱紀錄。"
          },
          "behavior-and-validation": {
            "score": 1,
            "reason": "Diff 與新增測試覆蓋 High 寬限期間、剛好邊界及 Completed High，且每個案例斷言 HTTP 200 與 overdue_ids；然而 oracle_results 為空，未見 Repository Gate、Normal 或 preservation 的執行證據，並記錄了 Automatic Failure：invalid_claim。"
          },
          "decision-and-escalation": {
            "score": 0,
            "reason": "Packet 未呈現 Repository facts、假設、未知、替代方案、授權界線或停止／升級條件；所列 Blind Spots 不構成這些決策證據。"
          }
        },
        "incremental_criteria": [
          {
            "criterion": "High Priority applies the exact two-hour timezone-aware boundary",
            "score": 1,
            "reason": "Diff 以 HIGH_PRIORITY_GRACE_PERIOD = timedelta(hours=2) 僅處理 High，並用 <= 使邊界納入；Z 時間戳 API 測試驗證 11:59:59 不納入與 12:00:00 納入，但沒有 Oracle 結果可獨立驗證。"
          },
          {
            "criterion": "HTTP status, response schema, Completed, and Normal behavior remain unchanged",
            "score": 1,
            "reason": "Diff 保留 Completed 排除與非 High 的原始 due_at_utc <= now 路徑，新增案例斷言 HTTP 200、overdue_ids 並檢查 Completed High；但缺乏 Normal、完整 schema 與 preservation Gate 的 Oracle 證據，且 Automatic Failure 為 invalid_claim。"
          }
        ]
      }
    },
    {
      "run_id": "react-effect-lifecycle--control--r01",
      "scenario_id": "react-effect-lifecycle",
      "language": "typescript-react",
      "arm_id": "control",
      "repetition": 1,
      "order_index": 2,
      "terminal_state": "passed",
      "contract_sha256": "fb1a68264c0f28cc36804ea63cff9d30a6d8903299b11dc3c2a87e8c68577dd0",
      "scenario_contract_sha256": "9b321658f4fc6fbf52c4431babf892daf93d6067317345ff597bf69d2e95c433",
      "prompt_sha256": "61748cfa0aad971701827d2b233b57616f6bdb0b0eca7fa2b06875a503e9f949",
      "automatic_failure_reasons": [],
      "diff_sha256": "a012db47744fc547963d23bb09396b416abf11c3855f9d353ef7e2c255205acc",
      "oracle_results": [
        {
          "group": "public",
          "commands": [
            {
              "args": [
                "npm",
                "test",
                "--",
                "src/WorkItemPreview.public.test.tsx"
              ],
              "exit_code": 0,
              "elapsed_seconds": 10.810627200000454,
              "timed_out": false,
              "classification": "success",
              "attempt": 1,
              "stdout_sha256": "27f83654737e341f567ab4ebbf14bec4f506d7fa6ac050ea59563cdd36c68848",
              "stderr_sha256": "e3b0c44298fc1c149afbf4c8996fb92427ae41e4649b934ca495991b7852b855"
            },
            {
              "args": [
                "npm",
                "run",
                "typecheck"
              ],
              "exit_code": 0,
              "elapsed_seconds": 2.582613400001719,
              "timed_out": false,
              "classification": "success",
              "attempt": 1,
              "stdout_sha256": "44f7e09adbec1042ab84fc4007ecf88115d594495f45fa0e0798451d0b52a41e",
              "stderr_sha256": "e3b0c44298fc1c149afbf4c8996fb92427ae41e4649b934ca495991b7852b855"
            },
            {
              "args": [
                "npm",
                "run",
                "lint"
              ],
              "exit_code": 0,
              "elapsed_seconds": 7.691268400001718,
              "timed_out": false,
              "classification": "success",